{
  "$schema": "https://json-schema.org/draft/2020-12/schema",
  "$id": "https://ligature-workspace/docs/closure-profile-schema.json",
  "title": "Closure profile — v1.0",
  "description": "plan.md §4's worked example, chainlink #25. One per cluster at specs/_closure/<cluster>.json (workspace-level, like specs/_conflicts/ -- a cluster spans crates by construction). A closure profile is a PER-CLUSTER declared property with a kind; there is deliberately no artifact in this pipeline that asserts closure globally (plan.md §4: 'Never a global pipeline guarantee'), and scripts/gate_g14.py prints per-cluster outcomes only. Two clusters with identical condition bits carry different guarantees, which is what closure_kind exists to keep visible: a Kani-owned cluster is `bounded` and must never read as full closure. Every condition scripts/gate_g14.py can recompute is recomputed and rejected on disagreement in BOTH directions (the same discipline G1b applies to computed eligibility in I) -- a declared condition bit is a claim to check, never an input to trust. The one exception is generic_callees_type_universal_or_creusot_owned (CG3), which needs type information no artifact in this pipeline carries: scripts/gate_g14.py computes it from the closure's own achieved records when those records determine it (chainlink #86), and when they do not it refuses to take the declaration as verified -- the condition is reported as a capability gap that blocks unless a degradation record (docs/degradation-record-schema.json) names it with a tracking issue, so a false `true` can never pass silently. closure_kind has exactly three values (chainlink #85): the two uniform claims over the whole closure -- `deductive` and `bounded` -- plus `partial`, the declaration of a partially-verified cluster that cannot achieve full deductive closure and must not be forced to round its claim up to `deductive` or down to `bounded`. A cluster that cannot meet its conditions carries a degradation record instead (docs/degradation-record-schema.json), which is a declared state, not a failure.",
  "type": "object",
  "required": ["schema_version", "cluster", "closure_kind", "work_packages", "conditions", "review"],
  "additionalProperties": false,
  "properties": {
    "schema_version": { "type": "string", "const": "1.0" },
    "cluster": {
      "type": "string",
      "pattern": "^[a-z0-9]+(?:-[a-z0-9]+)*$",
      "description": "Must equal the filename stem exactly (G1b, scripts/validate_closure.py), the same discipline boundary_id/interaction_id/bridge_id/report_id already follow."
    },
    "closure_kind": {
      "type": "string",
      "enum": ["deductive", "bounded", "partial"],
      "description": "plan.md §4's table: Creusot/Verus-owned -> deductive (universal over inputs, modulo SMT completeness and trusted specs); Kani-owned -> bounded (holds only within unwind/harness bounds and enumerated monomorphizations); partial (chainlink #85) -> partially verified: the cluster cannot achieve full deductive closure and declares that actual state instead of being forced to round the claim up to `deductive` (over-claiming) or down to `bounded` (claiming a uniform guarantee over a closure that does not deliver one uniformly). `deductive` and `bounded` are uniform claims over the WHOLE closure; `partial` claims strictly less than either, never more, so evidence kinds can refute `deductive` (a Kani result anywhere) but never `partial` -- a shortfall `partial` describes is surfaced by the findings that own it, not by this field (a missing achieved record blocks whatever the profile says, plan.md §4, and no degradation record can excuse an absence of evidence; a failing closure condition still needs its own degradation record, exactly as for the uniform kinds). Recomputed from the evidence kinds actually present across the transitive closure; a profile claiming `deductive` over a closure containing a Kani result is a G17 hard error, not a rounding-up."
    },
    "work_packages": {
      "type": "array",
      "minItems": 1,
      "uniqueItems": true,
      "items": { "type": "string", "minLength": 1 },
      "description": "The work-package manifests whose definition_of_done makes up this cluster (ci/manifest/<id>.json). An addition to plan.md §4's worked example, which names a cluster without saying what is in it: G14's transitive closure has to start somewhere, and deriving cluster membership by guesswork is exactly the kind of implicit scoping the rest of this pipeline refuses. The closure itself is NOT limited to these -- a required guarantee provided by a work package outside the cluster is followed and checked like any other, which is the whole point of a transitive closure."
    },
    "conditions": {
      "type": "object",
      "required": [
        "single_verifier_system",
        "owning_verifier",
        "protocol_class_all_pairwise",
        "unresolved_indirect_calls_at_or_above_medium",
        "generic_callees_type_universal_or_creusot_owned",
        "transitive_assumptions_within_policy",
        "scc_wellfoundedness_discharged"
      ],
      "additionalProperties": false,
      "description": "plan.md §4's condition block, field for field. Every one of these must hold for the cluster to close; a degradation record names the ones that do not (docs/degradation-record-schema.json's failed_conditions, whose enum is exactly these keys).",
      "properties": {
        "single_verifier_system": {
          "type": "boolean",
          "description": "One verifier system across the whole closure. False is the CG1 case (cross-verifier composition has no soundness theorem) and needs a degradation record with the `harness-tested` ceiling. Recomputed from the evidence kinds in the closure."
        },
        "owning_verifier": {
          "type": "string",
          "enum": ["creusot", "kani", "verus"],
          "description": "The verifier system this cluster's closure is owned by. Recomputed from the closure's achieved records; disagreement is rejected."
        },
        "protocol_class_all_pairwise": {
          "type": "boolean",
          "description": "Every bridge in the closure is protocol_class: pairwise (docs/bridge-schema.json). A non-pairwise protocol needs its own artifact or debt record (G15) and cannot be closed over by a pairwise bridge argument. Recomputed."
        },
        "unresolved_indirect_calls_at_or_above_medium": {
          "type": "integer",
          "minimum": 0,
          "description": "plan.md §4's own condition name. Read from scripts/gate_r1_g16.py's unresolved_at_or_above_medium() over the C_static reports (chainlink #24) -- never recomputed here, so the closure profile and the R1/G16 gate can never disagree about what 'unresolved' means. Must be 0 for the cluster to close."
        },
        "generic_callees_type_universal_or_creusot_owned": {
          "type": "boolean",
          "description": "CG3: Kani verifies generics per monomorphization, so universality over type parameters does not hold there. THE ONE CONDITION NO ARTIFACT CAN ALWAYS SETTLE -- which callees are generic is type information no artifact in this pipeline carries. scripts/gate_g14.py never takes it on its declaration alone (chainlink #86): it recomputes it from the closure's own achieved records whenever those records determine it (every closure work package has a recorded achievement and none of them is a Kani result), and otherwise reports it as an unverifiable capability gap that blocks unless a degradation record names it with capability_gap CG3 and a tracking issue -- declared and tracked, never silently accepted as checked."
        },
        "transitive_assumptions_within_policy": {
          "type": "boolean",
          "description": "Every assumption appearing in ANY achieved record anywhere in the transitive closure is allowed by the cluster's own entry requirements' trust_policy -- not merely by the policy of the edge it sits on. plan.md §8.5's opening case: 'Direct A->B checking passes while a C-level assumption sits below policy.' Recomputed."
        },
        "scc_wellfoundedness_discharged": {
          "oneOf": [
            { "type": "boolean" },
            { "type": "string", "const": "not-applicable" }
          ],
          "description": "CG6. `not-applicable` is required when the closure is acyclic -- a profile claiming `true` there would be claiming a discharge it never needed, which is a vacuous truth this schema declines to accept (the same objection #48 raised against a vacuous OK). When the closure has a cycle, this must be `true` AND every non-trivial SCC must have a matching entry in scc_discharges."
        }
      }
    },
    "scc_discharges": {
      "type": "array",
      "uniqueItems": true,
      "items": { "$ref": "#/$defs/scc_discharge" },
      "description": "plan.md §8.5's CG6 requirement: 'mutual satisfaction is not soundness'. One entry per non-trivial strongly-connected component in the closure. Required by G14 whenever a cycle exists (not by this schema, which cannot see the graph); an entry naming an SCC that does not exist is rejected as stale, so a discharge can never be a leftover asserting something about a graph that has since changed."
    },
    "review": { "$ref": "#/$defs/review" }
  },
  "$defs": {
    "scc_discharge": {
      "type": "object",
      "required": ["members", "kind", "argument"],
      "additionalProperties": false,
      "properties": {
        "members": {
          "type": "array",
          "minItems": 2,
          "uniqueItems": true,
          "items": { "$ref": "#/$defs/obligation_id" },
          "description": "The obligations in this SCC, exactly -- matched as a set against the SCC the gate computes. minItems 2 because a self-dependency (an obligation whose provider requires it back) is reported by G14 as its own single-member cycle and discharged by naming it twice would be nonsense; a genuine self-loop is a modelling error to fix, not to discharge."
        },
        "kind": {
          "type": "string",
          "enum": ["step-index", "decreasing-measure", "temporal-stratification"],
          "description": "plan.md §8.5's three named forms of well-foundedness argument. The vocabulary is closed deliberately: a free-text kind would let 'we reviewed it and it's fine' pass as a discharge."
        },
        "argument": {
          "type": "string",
          "minLength": 40,
          "description": "The actual argument: what the step index / measure / stratification is, and why no instantaneous circular dependence remains. Prose, human-authored, human-reviewed -- the gate checks that it exists, covers the right SCC, and was reviewed; it cannot check that it is correct, and does not claim to."
        }
      }
    },
    "obligation_id": {
      "type": "string",
      "pattern": "^[A-Z][A-Za-z0-9]*\\.[A-Z][0-9]+$",
      "description": "<Concept>.<id>, the same shape as a boundary contract's callee_guarantees entries and a work-package manifest's own obligation_id."
    },
    "review": {
      "type": "object",
      "required": ["reviewer", "reviewed_at"],
      "additionalProperties": false,
      "description": "plan.md §7.2 lists closure-profile/degradation-record acceptance as a human checkpoint. Attached by review_checkpoint.approve(), never authored by a proposing model.",
      "properties": {
        "reviewer": { "type": "string", "minLength": 1 },
        "reviewed_at": {
          "type": "string",
          "format": "date",
          "pattern": "^[0-9]{4}-[0-9]{2}-[0-9]{2}$"
        }
      }
    }
  }
}
