{
  "schema_version": "1.0",
  "cluster": "scheduler-core",
  "closure_kind": "deductive",
  "work_packages": ["WP-SCHED-001"],
  "conditions": {
    "single_verifier_system": true,
    "owning_verifier": "creusot",
    "protocol_class_all_pairwise": true,
    "unresolved_indirect_calls_at_or_above_medium": 0,
    "generic_callees_type_universal_or_creusot_owned": true,
    "transitive_assumptions_within_policy": true,
    "scc_wellfoundedness_discharged": "not-applicable"
  },
  "review": {
    "reviewer": "alice",
    "reviewed_at": "2026-09-04"
  }
}